{
  "prospect_domain": "orrin-labs.example",
  "prospect_name": "Orrin Labs Inc.",
  "generated_at": "2026-04-22T08:15:00Z",
  "primary_segment_match": "segment_1_series_a_b",
  "segment_confidence": 0.82,
  "crunchbase_firmographics": {
    "industry_tags": ["fintech", "payments", "b2b"],
    "employee_band": "51-200",
    "hq": "Nairobi, Kenya",
    "last_funding_stage": "series_b",
    "total_funding_usd": 26000000,
    "source_url": "https://www.crunchbase.com/organization/orrin-labs",
    "signal_confidence": 0.88
  },
  "ai_maturity": {
    "score": 2,
    "confidence": 0.7,
    "justifications": [
      {
        "signal": "ai_adjacent_open_roles",
        "status": "Two Data Platform Engineer roles and one ML Engineer role open on BuiltIn.",
        "weight": "high",
        "confidence": "high",
        "source_url": "https://builtin.com/company/orrin-labs/jobs"
      },
      {
        "signal": "named_ai_ml_leadership",
        "status": "No public Head of AI, VP Data, or Chief Scientist on the team page.",
        "weight": "high",
        "confidence": "high",
        "source_url": "https://orrin-labs.example/team"
      },
      {
        "signal": "executive_commentary",
        "status": "CEO roadmap mentions AI-powered insights as a 2026 priority.",
        "weight": "medium",
        "confidence": "medium",
        "source_url": "https://orrin-labs.example/blog/2026-roadmap"
      }
    ]
  },
  "hiring_velocity": {
    "open_roles_today": 11,
    "open_roles_60_days_ago": 4,
    "velocity_label": "doubled",
    "signal_confidence": 0.85,
    "sources": ["builtin", "wellfound", "company_careers_page"]
  },
  "buying_window_signals": {
    "funding_event": {
      "detected": true,
      "stage": "series_b",
      "amount_usd": 14000000,
      "closed_at": "2026-02-12",
      "source_url": "https://www.crunchbase.com/funding_round/orrin-labs-series-b",
      "signal_confidence": 0.9
    },
    "layoff_event": {
      "detected": false,
      "source_url": "https://layoffs.fyi/company/orrin-labs",
      "signal_confidence": 0.66
    },
    "leadership_change": {
      "detected": false,
      "source_url": "https://www.linkedin.com/company/orrin-labs/people/",
      "signal_confidence": 0.74
    }
  },
  "tech_stack": ["Python", "PostgreSQL", "dbt", "Snowflake", "AWS", "React", "TypeScript"],
  "bench_to_brief_match": {
    "required_stacks": ["python", "data"],
    "bench_available": true,
    "gaps": []
  },
  "data_sources_checked": [
    {
      "source": "crunchbase_odm",
      "status": "success",
      "fetched_at": "2026-04-22T08:12:15Z"
    },
    {
      "source": "layoffs_fyi",
      "status": "success",
      "fetched_at": "2026-04-22T08:12:30Z"
    },
    {
      "source": "builtin_jobs",
      "status": "success",
      "fetched_at": "2026-04-22T08:13:04Z"
    },
    {
      "source": "wellfound_jobs",
      "status": "success",
      "fetched_at": "2026-04-22T08:13:22Z"
    },
    {
      "source": "linkedin_public_leadership",
      "status": "partial",
      "error_message": "Rate limit hit on third pagination call; first two pages parsed successfully.",
      "fetched_at": "2026-04-22T08:13:40Z"
    }
  ],
  "honesty_flags": ["tech_stack_inferred_not_confirmed"]
}